root@CyberSecurityTK:~# tcpdump -n -i eth0
03:45:14.458151 IP 134.122.44.78.22 > 174.93.70.162.62320: Flags [P.], seq 360044:360256, ack 253, win 501, options [nop,nop,TS val 2112672987 ecr 845972360], length 212
03:45:14.458161 IP 174.93.70.162.62320 > 134.122.44.78.22: Flags [.], ack 360044, win 2679, options [nop,nop,TS val 845972360 ecr 2112672957,nop,nop,sack 1 {360256:366616}], length 0
03:45:14.458247 IP 174.93.70.162.62320 > 134.122.44.78.22: Flags [.], ack 360044, win 2679, options [nop,nop,TS val 845972360 ecr 2112672957,nop,nop,sack 1 {360256:366828}], length 0
03:45:14.458253 IP 174.93.70.162.62320 > 134.122.44.78.22: Flags [.], ack 360044, win 2679, options [nop,nop,TS val 845972362 ecr 2112672957,nop,nop,sack 1 {360256:367040}], length 0
03:45:14.458465 IP 134.122.44.78.22 > 174.93.70.162.62320: Flags [P.], seq 392676:395264, ack 253, win 501, options [nop,nop,TS val 2112672987 ecr 845972362], length 2588
03:45:14.462045 IP 174.93.70.162.62320 > 134.122.44.78.22: Flags [.], ack 360044, win 2679, options [nop,nop,TS val 845972363 ecr 2112672957,nop,nop,sack 2 {368480:368780}{360256:367040}], length 0
03:45:14.462096 IP 134.122.44.78.22 > 174.93.70.162.62320: Flags [P.], seq 395264:395476, ack 253, win 501, options [nop,nop,TS val 2112672991 ecr 845972363], length 212
03:45:14.462115 IP 174.93.70.162.62320 > 134.122.44.78.22: Flags [.], ack 360044, win 2679, options [nop,nop,TS val 845972363 ecr 2112672957,nop,nop,sack 1 {360256:368780}], length 0
03:45:14.462127 IP 174.93.70.162.62320 > 134.122.44.78.22: Flags [.], ack 360044, win 2679, options [nop,nop,TS val 845972363 ecr 2112672957,nop,nop,sack 2 {370220:371660}{360256:368780}], length 0
03:45:14.462416 IP 134.122.44.78.22 > 174.93.70.162.62320: Flags [P.], seq 395476:396264, ack 253, win 501, options [nop,nop,TS val 2112672991 ecr 845972363], length 788
03:45:14.467063 IP 174.93.70.162.62320 > 134.122.44.78.22: Flags [.], ack 360044, win 2679, options [nop,nop,TS val 845972366 ecr 2112672957,nop,nop,sack 1 {360256:371660}], length 0
03:45:14.467093 IP 134.122.44.78.22 > 174.93.70.162.62320: Flags [P.], seq 396264:396476, ack 253, win 501, options [nop,nop,TS val 2112672996 ecr 845972366], length 212
03:45:14.467110 IP 174.93.70.162.62320 > 134.122.44.78.22: Flags [.], ack 360044, win 2679, options [nop,nop,TS val 845972366 ecr 2112672957,nop,nop,sack 1 {360256:372912}], length 0
03:45:14.467163 IP 174.93.70.162.62320 > 134.122.44.78.22: Flags [.], ack 360044, win 2679, options [nop,nop,TS val 845972366 ecr 2112672957,nop,nop,sack 2 {374352:375684}{360256:372912}], length 0
03:45:14.467177 IP 174.93.70.162.62320 > 134.122.44.78.22: Flags [.], ack 360044, win 2679, options [nop,nop,TS val 845972366 ecr 2112672957,nop,nop,sack 1 {360256:375684}], length 0
03:45:14.467183 IP 174.93.70.162.62320 > 134.122.44.78.22: Flags [.], ack 360044, win 2679, options [nop,nop,TS val 845972366 ecr 2112672957,nop,nop,sack 1 {360256:376064}], length 0
03:45:14.467188 IP 174.93.70.162.62320 > 134.122.44.78.22: Flags [.], ack 360044, win 2679, options [nop,nop,TS val 845972366 ecr 2112672957,nop,nop,sack 1 {360256:376276}], length 0
03:45:14.467424 IP 134.122.44.78.22 > 174.93.70.162.62320: Flags [P.], seq 396476:397800, ack 253, win 501, options [nop,nop,TS val 2112672996 ecr 845972366], length 1324
03:45:14.467546 IP 134.122.44.78.22 > 174.93.70.162.62320: Flags [P.], seq 397800:398012, ack 253, win 501, options [nop,nop,TS val 2112672996 ecr 845972366], length 212
03:45:14.467639 IP 134.122.44.78.22 > 174.93.70.162.62320: Flags [P.], seq 398012:398224, ack 253, win 501, options [nop,nop,TS val 2112672996 ecr 845972366], length 212
03:45:14.467725 IP 134.122.44.78.22 > 174.93.70.162.62320: Flags [P.], seq 398224:398436, ack 253, win 501, options [nop,nop,TS val 2112672996 ecr 845972366], length 212
03:45:14.472834 IP 174.93.70.162.62320 > 134.122.44.78.22: Flags [.], ack 360044, win 2679, options [nop,nop,TS val 845972366 ecr 2112672957,nop,nop,sack 1 {360256:376488}], length 0
03:45:14.472877 IP 174.93.70.162.62320 > 134.122.44.78.22: Flags [.], ack 360044, win 2679, options [nop,nop,TS val 845972366 ecr 2112672957,nop,nop,sack 1 {360256:376700}], length 0
03:45:14.472891 IP 134.122.44.78.22 > 174.93.70.162.62320: Flags [P.], seq 398436:398648, ack 253, win 501, options [nop,nop,TS val 2112673002 ecr 845972366], length 212
03:45:14.472914 IP 174.93.70.162.62320 > 134.122.44.78.22: Flags [.], ack 360044, win 2679, options [nop,nop,TS val 845972366 ecr 2112672957,nop,nop,sack 1 {360256:376912}], length 0
03:45:14.472922 IP 174.93.70.162.62320 > 134.122.44.78.22: Flags [.], ack 360044, win 2679, options [nop,nop,TS val 845972366 ecr 2112672957,nop,nop,sack 1 {360256:377124}], length 0
03:45:14.472938 IP 174.93.70.162.62320 > 134.122.44.78.22: Flags [.], ack 360044, win 2679, options [nop,nop,TS val 845972366 ecr 2112672957,nop,nop,sack 1 {360256:377336}], length 0
03:45:14.472944 IP 174.93.70.162.62320 > 134.122.44.78.22: Flags [.], ack 360044, win 2679, options [nop,nop,TS val 845972366 ecr 2112672957,nop,nop,sack 1 {360256:377548}], length 0
03:45:14.472950 IP 174.93.70.162.62320 > 134.122.44.78.22: Flags [.], ack 360044, win 2679, options [nop,nop,TS val 845972368 ecr 2112672957,nop,nop,sack 1 {360256:377760}], length 0
03:45:14.472956 IP 174.93.70.162.62320 > 134.122.44.78.22: Flags [.], ack 360044, win 2679, options [nop,nop,TS val 845972368 ecr 2112672957,nop,nop,sack 1 {360256:377972}], length 0
03:45:14.473016 IP 174.93.70.162.62320 > 134.122.44.78.22: Flags [.], ack 360044, win 2679, options [nop,nop,TS val 845972368 ecr 2112672957,nop,nop,sack 1 {360256:378184}], length 0
03:45:14.473029 IP 174.93.70.162.62320 > 134.122.44.78.22: Flags [.], ack 360044, win 2679, options [nop,nop,TS val 845972368 ecr 2112672957,nop,nop,sack 1 {360256:378396}], length 0
03:45:14.473034 IP 174.93.70.162.62320 > 134.122.44.78.22: Flags [.], ack 360044, win 2679, options [nop,nop,TS val 845972368 ecr 2112672957,nop,nop,sack 1 {360256:378608}], length 0
03:45:14.473039 IP 174.93.70.162.62320 > 134.122.44.78.22: Flags [.], ack 360044, win 2679, options [nop,nop,TS val 845972368 ecr 2112672957,nop,nop,sack 1 {360256:378820}], length 0
03:45:14.473134 IP 174.93.70.162.62320 > 134.122.44.78.22: Flags [.], ack 360044, win 2679, options [nop,nop,TS val 845972368 ecr 2112672957,nop,nop,sack 1 {360256:380136}], length 0
03:45:14.473142 IP 174.93.70.162.62320 > 134.122.44.78.22: Flags [.], ack 360044, win 2679, options [nop,nop,TS val 845972368 ecr 2112672957,nop,nop,sack 1 {360256:380348}], length 0
03:45:14.473146 IP 174.93.70.162.62320 > 134.122.44.78.22: Flags [.], ack 360044, win 2679, options [nop,nop,TS val 845972368 ecr 2112672957,nop,nop,sack 1 {360256:380560}], length 0
03:45:14.473152 IP 174.93.70.162.62320 > 134.122.44.78.22: Flags [.], ack 360044, win 2679, options [nop,nop,TS val 845972368 ecr 2112672957,nop,nop,sack 1 {360256:380772}], length 0
03:45:14.473579 IP 174.93.70.162.62320 > 134.122.44.78.22: Flags [.], ack 360044, win 2679, options [nop,nop,TS val 845972368 ecr 2112672957,nop,nop,sack 2 {380984:381196}{360256:380772}], length 0
03:45:14.473595 IP 174.93.70.162.62320 > 134.122.44.78.22: Flags [.], ack 360044, win 2679, options [nop,nop,TS val 845972368 ecr 2112672957,nop,nop,sack 2 {380984:381408}{360256:380772}], length 0
03:45:14.473602 IP 174.93.70.162.62320 > 134.122.44.78.22: Flags [.], ack 360044, win 2679, options [nop,nop,TS val 845972368 ecr 2112672957,nop,nop,sack 2 {380984:381620}{360256:380772}], length 0
03:45:14.473609 IP 174.93.70.162.62320 > 134.122.44.78.22: Flags [.], ack 360044, win 2679, options [nop,nop,TS val 845972368 ecr 2112672957,nop,nop,sack 2 {380984:381832}{360256:380772}], length 0
03:45:14.473654 IP 174.93.70.162.62320 > 134.122.44.78.22: Flags [.], ack 360044, win 2679, options [nop,nop,TS val 845972368 ecr 2112672957,nop,nop,sack 2 {380984:382044}{360256:380772}], length 0
03:45:14.473661 IP 174.93.70.162.62320 > 134.122.44.78.22: Flags [.], ack 360044, win 2679, options [nop,nop,TS val 845972368 ecr 2112672957,nop,nop,sack 2 {380984:382256}{360256:380772}], length 0
03:45:14.473667 IP 174.93.70.162.62320 > 134.122.44.78.22: Flags [.], ack 360044, win 2679, options [nop,nop,TS val 845972368 ecr 2112672957,nop,nop,sack 2 {380984:382468}{360256:380772}], length 0
03:45:14.473672 IP 174.93.70.162.62320 > 134.122.44.78.22: Flags [.], ack 360044, win 2679, options [nop,nop,TS val 845972368 ecr 2112672957,nop,nop,sack 2 {380984:382680}{360256:380772}], length 0
03:45:14.473677 IP 174.93.70.162.62320 > 134.122.44.78.22: Flags [.], ack 360044, win 2679, options [nop,nop,TS val 845972368 ecr 2112672957,nop,nop,sack 2 {380984:382892}{360256:380772}], length 0
03:45:14.473682 IP 174.93.70.162.62320 > 134.122.44.78.22: Flags [.], ack 360044, win 2679, options [nop,nop,TS val 845972371 ecr 2112672957,nop,nop,sack 2 {380984:383104}{360256:380772}], length 0
03:45:14.473687 IP 174.93.70.162.62320 > 134.122.44.78.22: Flags [.], ack 360044, win 2679, options [nop,nop,TS val 845972371 ecr 2112672957,nop,nop,sack 2 {380984:383316}{360256:380772}], length 0
03:45:14.473692 IP 174.93.70.162.62320 > 134.122.44.78.22: Flags [.], ack 360044, win 2679, options [nop,nop,TS val 845972371 ecr 2112672957,nop,nop,sack 2 {380984:383528}{360256:380772}], length 0
03:45:14.473697 IP 174.93.70.162.62320 > 134.122.44.78.22: Flags [.], ack 360044, win 2679, options [nop,nop,TS val 845972371 ecr 2112672957,nop,nop,sack 2 {380984:383740}{360256:380772}], length 0
03:45:14.473703 IP 174.93.70.162.62320 > 134.122.44.78.22: Flags [.], ack 360044, win 2679, options [nop,nop,TS val 845972371 ecr 2112672957,nop,nop,sack 2 {380984:383952}{360256:380772}], length 0
03:45:14.473709 IP 174.93.70.162.62320 > 134.122.44.78.22: Flags [.], ack 360044, win 2679, options [nop,nop,TS val 845972371 ecr 2112672957,nop,nop,sack 2 {380984:384164}{360256:380772}], length 0
03:45:14.473715 IP 174.93.70.162.62320 > 134.122.44.78.22: Flags [.], ack 360044, win 2679, options [nop,nop,TS val 845972371 ecr 2112672957,nop,nop,sack 2 {380984:384376}{360256:380772}], length 0
03:45:14.473720 IP 174.93.70.162.62320 > 134.122.44.78.22: Flags [.], ack 360044, win 2679, options [nop,nop,TS val 845972371 ecr 2112672957,nop,nop,sack 2 {380984:384588}{360256:380772}], length 0
03:45:14.473725 IP 174.93.70.162.62320 > 134.122.44.78.22: Flags [.], ack 360044, win 2679, options [nop,nop,TS val 845972371 ecr 2112672957,nop,nop,sack 2 {380984:384800}{360256:380772}], length 0
03:45:14.473730 IP 174.93.70.162.62320 > 134.122.44.78.22: Flags [.], ack 360044, win 2679, options [nop,nop,TS val 845972371 ecr 2112672957,nop,nop,sack 2 {380984:385012}{360256:380772}], length 0
03:45:14.473735 IP 174.93.70.162.62320 > 134.122.44.78.22: Flags [.], ack 360044, win 2679, options [nop,nop,TS val 845972371 ecr 2112672957,nop,nop,sack 2 {380984:385224}{360256:380772}], length 0
03:45:14.474558 IP 134.122.44.78.22 > 174.93.70.162.62320: Flags [.], seq 398648:400088, ack 253, win 501, options [nop,nop,TS val 2112673003 ecr 845972371], length 1440
03:45:14.481075 IP 174.93.70.162.62320 > 134.122.44.78.22: Flags [.], ack 360044, win 2679, options [nop,nop,TS val 845972371 ecr 2112672957,nop,nop,sack 2 {380984:385436}{360256:380772}], length 0
03:45:14.481137 IP 134.122.44.78.22 > 174.93.70.162.62320: Flags [.], seq 400088:401528, ack 253, win 501, options [nop,nop,TS val 2112673010 ecr 845972371], length 1440
03:45:14.481163 IP 174.93.70.162.62320 > 134.122.44.78.22: Flags [.], ack 360044, win 2679, options [nop,nop,TS val 845972371 ecr 2112672957,nop,nop,sack 2 {380984:385648}{360256:380772}], length 0
03:45:14.481176 IP 134.122.44.78.22 > 174.93.70.162.62320: Flags [.], seq 401528:402968, ack 253, win 501, options [nop,nop,TS val 2112673010 ecr 845972371], length 1440
03:45:14.481181 IP 174.93.70.162.62320 > 134.122.44.78.22: Flags [.], ack 360044, win 2679, options [nop,nop,TS val 845972371 ecr 2112672957,nop,nop,sack 2 {380984:385860}{360256:380772}], length 0
03:45:14.481191 IP 134.122.44.78.22 > 174.93.70.162.62320: Flags [.], seq 402968:404408, ack 253, win 501, options [nop,nop,TS val 2112673010 ecr 845972371], length 1440
03:45:14.481209 IP 174.93.70.162.62320 > 134.122.44.78.22: Flags [.], ack 360044, win 2679, options [nop,nop,TS val 845972371 ecr 2112672957,nop,nop,sack 2 {380984:386072}{360256:380772}], length 0
03:45:14.481227 IP 134.122.44.78.22 > 174.93.70.162.62320: Flags [.], seq 404408:405848, ack 253, win 501, options [nop,nop,TS val 2112673010 ecr 845972371], length 1440
03:45:14.481239 IP 174.93.70.162.62320 > 134.122.44.78.22: Flags [.], ack 360044, win 2679, options [nop,nop,TS val 845972371 ecr 2112672957,nop,nop,sack 2 {380984:386284}{360256:380772}], length 0
03:45:14.481247 IP 134.122.44.78.22 > 174.93.70.162.62320: Flags [P.], seq 405848:406028, ack 253, win 501, options [nop,nop,TS val 2112673010 ecr 845972371], length 180
03:45:14.481251 IP 174.93.70.162.62320 > 134.122.44.78.22: Flags [.], ack 360044, win 2679, options [nop,nop,TS val 845972371 ecr 2112672957,nop,nop,sack 2 {380984:386496}{360256:380772}], length 0
03:45:14.481266 IP 174.93.70.162.62320 > 134.122.44.78.22: Flags [.], ack 360044, win 2679, options [nop,nop,TS val 845972371 ecr 2112672957,nop,nop,sack 2 {380984:386708}{360256:380772}], length 0
03:45:14.481272 IP 174.93.70.162.62320 > 134.122.44.78.22: Flags [.], ack 360044, win 2679, options [nop,nop,TS val 845972371 ecr 2112672957,nop,nop,sack 2 {380984:386920}{360256:380772}], length 0
03:45:14.481282 IP 134.122.44.78.22 > 174.93.70.162.62320: Flags [P.], seq 380772:380984, ack 253, win 501, options [nop,nop,TS val 2112673010 ecr 845972371], length 212
03:45:14.481296 IP 174.93.70.162.62320 > 134.122.44.78.22: Flags [.], ack 360044, win 2679, options [nop,nop,TS val 845972371 ecr 2112672957,nop,nop,sack 2 {380984:387132}{360256:380772}], length 0
03:45:14.481311 IP 174.93.70.162.62320 > 134.122.44.78.22: Flags [.], ack 360044, win 2679, options [nop,nop,TS val 845972374 ecr 2112672957,nop,nop,sack 2 {380984:387344}{360256:380772}], length 0
03:45:14.481318 IP 174.93.70.162.62320 > 134.122.44.78.22: Flags [.], ack 360044, win 2679, options [nop,nop,TS val 845972374 ecr 2112672957,nop,nop,sack 2 {380984:388476}{360256:380772}], length 0
03:45:14.481375 IP 174.93.70.162.62320 > 134.122.44.78.22: Flags [.], ack 360044, win 2679, options [nop,nop,TS val 845972374 ecr 2112672957,nop,nop,sack 2 {380984:388688}{360256:380772}], length 0
03:45:14.481385 IP 174.93.70.162.62320 > 134.122.44.78.22: Flags [.], ack 360044, win 2679, options [nop,nop,TS val 845972374 ecr 2112672957,nop,nop,sack 2 {380984:388900}{360256:380772}], length 0
03:45:14.481393 IP 174.93.70.162.62320 > 134.122.44.78.22: Flags [.], ack 360044, win 2679, options [nop,nop,TS val 845972374 ecr 2112672957,nop,nop,sack 2 {380984:389112}{360256:380772}], length 0
03:45:14.481400 IP 174.93.70.162.62320 > 134.122.44.78.22: Flags [.], ack 360044, win 2679, options [nop,nop,TS val 845972374 ecr 2112672957,nop,nop,sack 2 {380984:389324}{360256:380772}], length 0
03:45:14.481535 IP 174.93.70.162.62320 > 134.122.44.78.22: Flags [.], ack 360044, win 2679, options [nop,nop,TS val 845972374 ecr 2112672957,nop,nop,sack 2 {380984:389904}{360256:380772}], length 0
03:45:14.481550 IP 174.93.70.162.62320 > 134.122.44.78.22: Flags [.], ack 360044, win 2679, options [nop,nop,TS val 845972377 ecr 2112672957,nop,nop,sack 2 {380984:390116}{360256:380772}], length 0
03:45:14.481555 IP 174.93.70.162.62320 > 134.122.44.78.22: Flags [.], ack 360044, win 2679, options [nop,nop,TS val 845972377 ecr 2112672957,nop,nop,sack 3 {391556:391616}{380984:390116}{360256:380772}], length 0
03:45:14.481565 IP 174.93.70.162.62320 > 134.122.44.78.22: Flags [.], ack 360044, win 2679, options [nop,nop,TS val 845972377 ecr 2112672957,nop,nop,sack 2 {380984:391616}{360256:380772}], length 0
03:45:14.481620 IP 174.93.70.162.62320 > 134.122.44.78.22: Flags [.], ack 360044, win 2679, options [nop,nop,TS val 845972377 ecr 2112672957,nop,nop,sack 2 {380984:391828}{360256:380772}], length 0
03:45:14.481627 IP 174.93.70.162.62320 > 134.122.44.78.22: Flags [.], ack 360044, win 2679, options [nop,nop,TS val 845972377 ecr 2112672957,nop,nop,sack 2 {380984:392040}{360256:380772}], length 0
03:45:14.481634 IP 174.93.70.162.62320 > 134.122.44.78.22: Flags [.], ack 360044, win 2679, options [nop,nop,TS val 845972377 ecr 2112672957,nop,nop,sack 2 {380984:392252}{360256:380772}], length 0
03:45:14.481641 IP 174.93.70.162.62320 > 134.122.44.78.22: Flags [.], ack 360044, win 2679, options [nop,nop,TS val 845972377 ecr 2112672957,nop,nop,sack 2 {380984:392464}{360256:380772}], length 0
03:45:14.481757 IP 174.93.70.162.62320 > 134.122.44.78.22: Flags [.], ack 360044, win 2679, options [nop,nop,TS val 845972377 ecr 2112672957,nop,nop,sack 2 {380984:392676}{360256:380772}], length 0
03:45:14.481770 IP 174.93.70.162.62320 > 134.122.44.78.22: Flags [.], ack 380772, win 2355, options [nop,nop,TS val 845972377 ecr 2112672987,nop,nop,sack 1 {380984:392676}], length 0
03:45:14.481788 IP 174.93.70.162.62320 > 134.122.44.78.22: Flags [.], ack 380772, win 2355, options [nop,nop,TS val 845972377 ecr 2112672987,nop,nop,sack 2 {394116:395264}{380984:392676}], length 0
03:45:14.481796 IP 174.93.70.162.62320 > 134.122.44.78.22: Flags [.], ack 380772, win 2355, options [nop,nop,TS val 845972377 ecr 2112672987,nop,nop,sack 1 {380984:395264}], length 0
03:45:14.481869 IP 174.93.70.162.62320 > 134.122.44.78.22: Flags [.], ack 380772, win 2483, options [nop,nop,TS val 845972377 ecr 2112672987,nop,nop,sack 1 {380984:395264}], length 0
03:45:14.481876 IP 174.93.70.162.62320 > 134.122.44.78.22: Flags [.], ack 380772, win 2611, options [nop,nop,TS val 845972378 ecr 2112672987,nop,nop,sack 1 {380984:395264}], length 0
03:45:14.481879 IP 174.93.70.162.62320 > 134.122.44.78.22: Flags [.], ack 380772, win 2679, options [nop,nop,TS val 845972379 ecr 2112672987,nop,nop,sack 1 {380984:395264}], length 0
03:45:14.481997 IP 134.122.44.78.22 > 174.93.70.162.62320: Flags [.], seq 406028:407468, ack 253, win 501, options [nop,nop,TS val 2112673011 ecr 845972379], length 1440
03:45:14.490387 IP 174.93.70.162.62320 > 134.122.44.78.22: Flags [.], ack 380772, win 2679, options [nop,nop,TS val 845972382 ecr 2112672987,nop,nop,sack 1 {380984:395476}], length 0
03:45:14.490485 IP 134.122.44.78.22 > 174.93.70.162.62320: Flags [.], seq 407468:408908, ack 253, win 501, options [nop,nop,TS val 2112673019 ecr 845972382], length 1440
03:45:14.490522 IP 174.93.70.162.62320 > 134.122.44.78.22: Flags [.], ack 380772, win 2679, options [nop,nop,TS val 845972382 ecr 2112672987,nop,nop,sack 1 {380984:396264}], length 0
03:45:14.490543 IP 134.122.44.78.22 > 174.93.70.162.62320: Flags [.], seq 408908:410348, ack 253, win 501, options [nop,nop,TS val 2112673019 ecr 845972382], length 1440
03:45:14.490552 IP 174.93.70.162.62320 > 134.122.44.78.22: Flags [.], ack 380772, win 2679, options [nop,nop,TS val 845972387 ecr 2112672987,nop,nop,sack 1 {380984:396476}], length 0
03:45:14.490564 IP 134.122.44.78.22 > 174.93.70.162.62320: Flags [.], seq 410348:411788, ack 253, win 501, options [nop,nop,TS val 2112673019 ecr 845972387], length 1440
03:45:14.490603 IP 174.93.70.162.62320 > 134.122.44.78.22: Flags [.], ack 380772, win 2679, options [nop,nop,TS val 845972387 ecr 2112672987,nop,nop,sack 1 {380984:397800}], length 0
03:45:14.490631 IP 134.122.44.78.22 > 174.93.70.162.62320: Flags [.], seq 411788:413228, ack 253, win 501, options [nop,nop,TS val 2112673019 ecr 845972387], length 1440
03:45:14.492059 IP 174.93.70.162.62320 > 134.122.44.78.22: Flags [.], ack 380772, win 2679, options [nop,nop,TS val 845972387 ecr 2112672987,nop,nop,sack 1 {380984:398012}], length 0
03:45:14.492096 IP 134.122.44.78.22 > 174.93.70.162.62320: Flags [.], seq 413228:414668, ack 253, win 501, options [nop,nop,TS val 2112673021 ecr 845972387], length 1440
03:45:14.492123 IP 174.93.70.162.62320 > 134.122.44.78.22: Flags [.], ack 380772, win 2679, options [nop,nop,TS val 845972387 ecr 2112672987,nop,nop,sack 1 {380984:398224}], length 0
03:45:14.492156 IP 134.122.44.78.22 > 174.93.70.162.62320: Flags [P.], seq 414668:415228, ack 253, win 501, options [nop,nop,TS val 2112673021 ecr 845972387], length 560
03:45:14.492177 IP 174.93.70.162.62320 > 134.122.44.78.22: Flags [.], ack 380772, win 2679, options [nop,nop,TS val 845972387 ecr 2112672987,nop,nop,sack 1 {380984:398436}], length 0
03:45:14.492201 IP 174.93.70.162.62320 > 134.122.44.78.22: Flags [.], ack 380772, win 2679, options [nop,nop,TS val 845972393 ecr 2112672987,nop,nop,sack 1 {380984:398648}], length 0
03:45:14.492210 IP 174.93.70.162.62320 > 134.122.44.78.22: Flags [.], ack 380772, win 2679, options [nop,nop,TS val 845972393 ecr 2112672987,nop,nop,sack 1 {380984:400088}], length 0
03:45:14.492368 IP 134.122.44.78.22 > 174.93.70.162.62320: Flags [P.], seq 415228:415448, ack 253, win 501, options [nop,nop,TS val 2112673021 ecr 845972393], length 220
03:45:14.494689 IP 174.93.70.162.62320 > 134.122.44.78.22: Flags [.], ack 380772, win 2679, options [nop,nop,TS val 845972400 ecr 2112672987,nop,nop,sack 1 {380984:401528}], length 0
03:45:14.494727 IP 134.122.44.78.22 > 174.93.70.162.62320: Flags [P.], seq 415448:416856, ack 253, win 501, options [nop,nop,TS val 2112673023 ecr 845972400], length 1408
03:45:14.496421 IP 174.93.70.162.62320 > 134.122.44.78.22: Flags [.], ack 380772, win 2679, options [nop,nop,TS val 845972400 ecr 2112672987,nop,nop,sack 1 {380984:402968}], length 0
03:45:14.496450 IP 134.122.44.78.22 > 174.93.70.162.62320: Flags [P.], seq 416856:417352, ack 253, win 501, options [nop,nop,TS val 2112673025 ecr 845972400], length 496
03:45:14.499046 IP 174.93.70.162.62320 > 134.122.44.78.22: Flags [.], ack 380772, win 2679, options [nop,nop,TS val 845972400 ecr 2112672987,nop,nop,sack 1 {380984:404408}], length 0
03:45:14.499071 IP 134.122.44.78.22 > 174.93.70.162.62320: Flags [P.], seq 417352:417848, ack 253, win 501, options [nop,nop,TS val 2112673028 ecr 845972400], length 496
03:45:14.499152 IP 174.93.70.162.62320 > 134.122.44.78.22: Flags [.], ack 380772, win 2679, options [nop,nop,TS val 845972400 ecr 2112672987,nop,nop,sack 2 {405848:406028}{380984:404408}], length 0
03:45:14.499167 IP 174.93.70.162.62320 > 134.122.44.78.22: Flags [.], ack 380772, win 2679, options [nop,nop,TS val 845972400 ecr 2112672987,nop,nop,sack 1 {380984:406028}], length 0
03:45:14.499173 IP 174.93.70.162.62320 > 134.122.44.78.22: Flags [.], ack 406028, win 2284, options [nop,nop,TS val 845972400 ecr 2112673010], length 0
03:45:14.499196 IP 174.93.70.162.62320 > 134.122.44.78.22: Flags [.], ack 407468, win 2390, options [nop,nop,TS val 845972400 ecr 2112673011], length 0
03:45:14.499251 IP 134.122.44.78.22 > 174.93.70.162.62320: Flags [P.], seq 417848:418068, ack 253, win 501, options [nop,nop,TS val 2112673028 ecr 845972400], length 220
03:45:14.499277 IP 174.93.70.162.62320 > 134.122.44.78.22: Flags [.], ack 407468, win 2518, options [nop,nop,TS val 845972401 ecr 2112673011], length 0
03:45:14.499283 IP 174.93.70.162.62320 > 134.122.44.78.22: Flags [.], ack 407468, win 2646, options [nop,nop,TS val 845972401 ecr 2112673011], length 0
03:45:14.499286 IP 174.93.70.162.62320 > 134.122.44.78.22: Flags [P.], seq 253:289, ack 407468, win 2679, options [nop,nop,TS val 845972401 ecr 2112673011], length 36
03:45:14.499402 IP 134.122.44.78.22 > 174.93.70.162.62320: Flags [P.], seq 418068:418280, ack 289, win 501, options [nop,nop,TS val 2112673028 ecr 845972401], length 212
03:45:14.499522 IP 134.122.44.78.22 > 174.93.70.162.62320: Flags [P.], seq 418280:418700, ack 289, win 501, options [nop,nop,TS val 2112673028 ecr 845972401], length 420
03:45:14.499657 IP 134.122.44.78.22 > 174.93.70.162.62320: Flags [P.], seq 418700:419216, ack 289, win 501, options [nop,nop,TS val 2112673028 ecr 845972401], length 516
03:45:14.499803 IP 134.122.44.78.22 > 174.93.70.162.62320: Flags [P.], seq 419216:419900, ack 289, win 501, options [nop,nop,TS val 2112673028 ecr 845972401], length 684
03:45:14.499926 IP 134.122.44.78.22 > 174.93.70.162.62320: Flags [P.], seq 419900:420448, ack 289, win 501, options [nop,nop,TS val 2112673029 ecr 845972401], length 548
03:45:14.500036 IP 134.122.44.78.22 > 174.93.70.162.62320: Flags [P.], seq 420448:420660, ack 289, win 501, options [nop,nop,TS val 2112673029 ecr 845972401], length 212
03:45:14.500139 IP 134.122.44.78.22 > 174.93.70.162.62320: Flags [P.], seq 420660:420872, ack 289, win 501, options [nop,nop,TS val 2112673029 ecr 845972401], length 212
03:45:14.500248 IP 134.122.44.78.22 > 174.93.70.162.62320: Flags [P.], seq 420872:421084, ack 289, win 501, options [nop,nop,TS val 2112673029 ecr 845972401], length 212
03:45:14.500351 IP 134.122.44.78.22 > 174.93.70.162.62320: Flags [P.], seq 421084:421296, ack 289, win 501, options [nop,nop,TS val 2112673029 ecr 845972401], length 212
03:45:14.500455 IP 134.122.44.78.22 > 174.93.70.162.62320: Flags [P.], seq 421296:421508, ack 289, win 501, options [nop,nop,TS val 2112673029 ecr 845972401], length 212
03:45:14.500555 IP 134.122.44.78.22 > 174.93.70.162.62320: Flags [P.], seq 421508:421720, ack 289, win 501, options [nop,nop,TS val 2112673029 ecr 845972401], length 212
03:45:14.500642 IP 134.122.44.78.22 > 174.93.70.162.62320: Flags [P.], seq 421720:421932, ack 289, win 501, options [nop,nop,TS val 2112673029 ecr 845972401], length 212
03:45:14.500724 IP 134.122.44.78.22 > 174.93.70.162.62320: Flags [P.], seq 421932:422144, ack 289, win 501, options [nop,nop,TS val 2112673029 ecr 845972401], length 212
03:45:14.500847 IP 134.122.44.78.22 > 174.93.70.162.62320: Flags [P.], seq 422144:422356, ack 289, win 501, options [nop,nop,TS val 2112673030 ecr 845972401], length 212
03:45:14.500984 IP 134.122.44.78.22 > 174.93.70.162.62320: Flags [P.], seq 422356:422568, ack 289, win 501, options [nop,nop,TS val 2112673030 ecr 845972401], length 212
03:45:14.501087 IP 134.122.44.78.22 > 174.93.70.162.62320: Flags [P.], seq 422568:422780, ack 289, win 501, options [nop,nop,TS val 2112673030 ecr 845972401], length 212
03:45:14.501177 IP 134.122.44.78.22 > 174.93.70.162.62320: Flags [P.], seq 422780:422992, ack 289, win 501, options [nop,nop,TS val 2112673030 ecr 845972401], length 212
03:45:14.501263 IP 134.122.44.78.22 > 174.93.70.162.62320: Flags [P.], seq 422992:423204, ack 289, win 501, options [nop,nop,TS val 2112673030 ecr 845972401], length 212
03:45:14.501348 IP 134.122.44.78.22 > 174.93.70.162.62320: Flags [P.], seq 423204:423416, ack 289, win 501, options [nop,nop,TS val 2112673030 ecr 845972401], length 212
03:45:14.501428 IP 134.122.44.78.22 > 174.93.70.162.62320: Flags [P.], seq 423416:423628, ack 289, win 501, options [nop,nop,TS val 2112673030 ecr 845972401], length 212
03:45:14.501533 IP 134.122.44.78.22 > 174.93.70.162.62320: Flags [P.], seq 423628:423840, ack 289, win 501, options [nop,nop,TS val 2112673030 ecr 845972401], length 212
03:45:14.501620 IP 134.122.44.78.22 > 174.93.70.162.62320: Flags [P.], seq 423840:424052, ack 289, win 501, options [nop,nop,TS val 2112673030 ecr 845972401], length 212
03:45:14.501704 IP 134.122.44.78.22 > 174.93.70.162.62320: Flags [P.], seq 424052:424264, ack 289, win 501, options [nop,nop,TS val 2112673030 ecr 845972401], length 212
03:45:14.501802 IP 134.122.44.78.22 > 174.93.70.162.62320: Flags [P.], seq 424264:424476, ack 289, win 501, options [nop,nop,TS val 2112673030 ecr 845972401], length 212
03:45:14.501885 IP 134.122.44.78.22 > 174.93.70.162.62320: Flags [P.], seq 424476:424688, ack 289, win 501, options [nop,nop,TS val 2112673031 ecr 845972401], length 212
03:45:14.501969 IP 134.122.44.78.22 > 174.93.70.162.62320: Flags [P.], seq 424688:424900, ack 289, win 501, options [nop,nop,TS val 2112673031 ecr 845972401], length 212
03:45:14.502049 IP 134.122.44.78.22 > 174.93.70.162.62320: Flags [P.], seq 424900:425112, ack 289, win 501, options [nop,nop,TS val 2112673031 ecr 845972401], length 212
03:45:14.502131 IP 134.122.44.78.22 > 174.93.70.162.62320: Flags [P.], seq 425112:425324, ack 289, win 501, options [nop,nop,TS val 2112673031 ecr 845972401], length 212
03:45:14.502213 IP 134.122.44.78.22 > 174.93.70.162.62320: Flags [P.], seq 425324:425536, ack 289, win 501, options [nop,nop,TS val 2112673031 ecr 845972401], length 212
03:45:14.502295 IP 134.122.44.78.22 > 174.93.70.162.62320: Flags [P.], seq 425536:425748, ack 289, win 501, options [nop,nop,TS val 2112673031 ecr 845972401], length 212
03:45:14.502376 IP 134.122.44.78.22 > 174.93.70.162.62320: Flags [P.], seq 425748:425960, ack 289, win 501, options [nop,nop,TS val 2112673031 ecr 845972401], length 212
03:45:14.502468 IP 134.122.44.78.22 > 174.93.70.162.62320: Flags [P.], seq 425960:426172, ack 289, win 501, options [nop,nop,TS val 2112673031 ecr 845972401], length 212
03:45:14.502552 IP 134.122.44.78.22 > 174.93.70.162.62320: Flags [P.], seq 426172:426384, ack 289, win 501, options [nop,nop,TS val 2112673031 ecr 845972401], length 212
03:45:14.502641 IP 134.122.44.78.22 > 174.93.70.162.62320: Flags [P.], seq 426384:426596, ack 289, win 501, options [nop,nop,TS val 2112673031 ecr 845972401], length 212
03:45:14.502724 IP 134.122.44.78.22 > 174.93.70.162.62320: Flags [P.], seq 426596:426808, ack 289, win 501, options [nop,nop,TS val 2112673031 ecr 845972401], length 212
03:45:14.502830 IP 134.122.44.78.22 > 174.93.70.162.62320: Flags [P.], seq 426808:427020, ack 289, win 501, options [nop,nop,TS val 2112673032 ecr 845972401], length 212
03:45:14.502941 IP 134.122.44.78.22 > 174.93.70.162.62320: Flags [P.], seq 427020:427232, ack 289, win 501, options [nop,nop,TS val 2112673032 ecr 845972401], length 212
03:45:14.503034 IP 134.122.44.78.22 > 174.93.70.162.62320: Flags [P.], seq 427232:427444, ack 289, win 501, options [nop,nop,TS val 2112673032 ecr 845972401], length 212
03:45:14.503133 IP 134.122.44.78.22 > 174.93.70.162.62320: Flags [P.], seq 427444:427656, ack 289, win 501, options [nop,nop,TS val 2112673032 ecr 845972401], length 212
03:45:14.503217 IP 134.122.44.78.22 > 174.93.70.162.62320: Flags [P.], seq 427656:427868, ack 289, win 501, options [nop,nop,TS val 2112673032 ecr 845972401], length 212
03:45:14.503300 IP 134.122.44.78.22 > 174.93.70.162.62320: Flags [P.], seq 427868:428080, ack 289, win 501, options [nop,nop,TS val 2112673032 ecr 845972401], length 212
03:45:14.503382 IP 134.122.44.78.22 > 174.93.70.162.62320: Flags [P.], seq 428080:428292, ack 289, win 501, options [nop,nop,TS val 2112673032 ecr 845972401], length 212
03:45:14.503465 IP 134.122.44.78.22 > 174.93.70.162.62320: Flags [P.], seq 428292:428504, ack 289, win 501, options [nop,nop,TS val 2112673032 ecr 845972401], length 212
03:45:14.503561 IP 134.122.44.78.22 > 174.93.70.162.62320: Flags [P.], seq 428504:428716, ack 289, win 501, options [nop,nop,TS val 2112673032 ecr 845972401], length 212
03:45:14.503653 IP 134.122.44.78.22 > 174.93.70.162.62320: Flags [P.], seq 428716:428928, ack 289, win 501, options [nop,nop,TS val 2112673032 ecr 845972401], length 212
03:45:14.503739 IP 134.122.44.78.22 > 174.93.70.162.62320: Flags [P.], seq 428928:429140, ack 289, win 501, options [nop,nop,TS val 2112673032 ecr 845972401], length 212
03:45:14.506935 IP 174.93.70.162.62320 > 134.122.44.78.22: Flags [.], ack 410348, win 2634, options [nop,nop,TS val 845972406 ecr 2112673019], length 0
03:45:14.506970 IP 134.122.44.78.22 > 174.93.70.162.62320: Flags [P.], seq 429140:429352, ack 289, win 501, options [nop,nop,TS val 2112673036 ecr 845972406], length 212
03:45:14.506988 IP 174.93.70.162.62320 > 134.122.44.78.22: Flags [.], ack 410348, win 2679, options [nop,nop,TS val 845972406 ecr 2112673019], length 0
03:45:14.506993 IP 174.93.70.162.62320 > 134.122.44.78.22: Flags [.], ack 413228, win 2634, options [nop,nop,TS val 845972406 ecr 2112673019], length 0
03:45:14.506998 IP 174.93.70.162.62320 > 134.122.44.78.22: Flags [.], ack 413228, win 2679, options [nop,nop,TS val 845972406 ecr 2112673019], length 0
03:45:14.507211 IP 134.122.44.78.22 > 174.93.70.162.62320: Flags [P.], seq 429352:430172, ack 289, win 501, options [nop,nop,TS val 2112673036 ecr 845972406], length 820
03:45:14.507314 IP 134.122.44.78.22 > 174.93.70.162.62320: Flags [P.], seq 430172:430384, ack 289, win 501, options [nop,nop,TS val 2112673036 ecr 845972406], length 212
03:45:14.507402 IP 134.122.44.78.22 > 174.93.70.162.62320: Flags [P.], seq 430384:430596, ack 289, win 501, options [nop,nop,TS val 2112673036 ecr 845972406], length 212
03:45:14.514574 IP 174.93.70.162.62320 > 134.122.44.78.22: Flags [.], ack 415228, win 2648, options [nop,nop,TS val 845972408 ecr 2112673021], length 0
03:45:14.514636 IP 134.122.44.78.22 > 174.93.70.162.62320: Flags [P.], seq 430596:430808, ack 289, win 501, options [nop,nop,TS val 2112673043 ecr 845972408], length 212
03:45:14.514665 IP 174.93.70.162.62320 > 134.122.44.78.22: Flags [.], ack 415448, win 2675, options [nop,nop,TS val 845972409 ecr 2112673021], length 0
03:45:14.514995 IP 134.122.44.78.22 > 174.93.70.162.62320: Flags [P.], seq 430808:431324, ack 289, win 501, options [nop,nop,TS val 2112673044 ecr 845972409], length 516
03:45:14.515168 IP 134.122.44.78.22 > 174.93.70.162.62320: Flags [P.], seq 431324:431536, ack 289, win 501, options [nop,nop,TS val 2112673044 ecr 845972409], length 212
03:45:14.521088 IP 174.93.70.162.62320 > 134.122.44.78.22: Flags [.], ack 416856, win 2657, options [nop,nop,TS val 845972411 ecr 2112673023], length 0
03:45:14.521146 IP 134.122.44.78.22 > 174.93.70.162.62320: Flags [P.], seq 431536:431748, ack 289, win 501, options [nop,nop,TS val 2112673050 ecr 845972411], length 212
03:45:14.521176 IP 174.93.70.162.62320 > 134.122.44.78.22: Flags [.], ack 417352, win 2671, options [nop,nop,TS val 845972411 ecr 2112673025], length 0
03:45:14.521188 IP 174.93.70.162.62320 > 134.122.44.78.22: Flags [.], ack 417848, win 2671, options [nop,nop,TS val 845972414 ecr 2112673028], length 0
03:45:14.521211 IP 174.93.70.162.62320 > 134.122.44.78.22: Flags [.], ack 418068, win 2668, options [nop,nop,TS val 845972414 ecr 2112673028], length 0
03:45:14.521219 IP 174.93.70.162.62320 > 134.122.44.78.22: Flags [.], ack 418280, win 2664, options [nop,nop,TS val 845972414 ecr 2112673028], length 0
03:45:14.521246 IP 174.93.70.162.62320 > 134.122.44.78.22: Flags [.], ack 418700, win 2658, options [nop,nop,TS val 845972414 ecr 2112673028], length 0
03:45:14.521254 IP 174.93.70.162.62320 > 134.122.44.78.22: Flags [.], ack 419216, win 2650, options [nop,nop,TS val 845972414 ecr 2112673028], length 0
03:45:14.521264 IP 174.93.70.162.62320 > 134.122.44.78.22: Flags [.], ack 419900, win 2668, options [nop,nop,TS val 845972414 ecr 2112673028], length 0
03:45:14.521271 IP 174.93.70.162.62320 > 134.122.44.78.22: Flags [.], ack 419900, win 2668, options [nop,nop,TS val 845972414 ecr 2112673028,nop,nop,sack 1 {420448:420660}], length 0
03:45:14.521926 IP 134.122.44.78.22 > 174.93.70.162.62320: Flags [P.], seq 431748:433368, ack 289, win 501, options [nop,nop,TS val 2112673051 ecr 845972414], length 1620
03:45:14.522142 IP 134.122.44.78.22 > 174.93.70.162.62320: Flags [P.], seq 433368:433580, ack 289, win 501, options [nop,nop,TS val 2112673051 ecr 845972414], length 212
03:45:14.522332 IP 134.122.44.78.22 > 174.93.70.162.62320: Flags [P.], seq 433580:433792, ack 289, win 501, options [nop,nop,TS val 2112673051 ecr 845972414], length 212
03:45:14.522466 IP 134.122.44.78.22 > 174.93.70.162.62320: Flags [P.], seq 433792:434004, ack 289, win 501, options [nop,nop,TS val 2112673051 ecr 845972414], length 212
03:45:14.522624 IP 134.122.44.78.22 > 174.93.70.162.62320: Flags [P.], seq 434004:434216, ack 289, win 501, options [nop,nop,TS val 2112673051 ecr 845972414], length 212
03:45:14.522742 IP 134.122.44.78.22 > 174.93.70.162.62320: Flags [P.], seq 434216:434428, ack 289, win 501, options [nop,nop,TS val 2112673051 ecr 845972414], length 212
03:45:14.522884 IP 134.122.44.78.22 > 174.93.70.162.62320: Flags [P.], seq 434428:434640, ack 289, win 501, options [nop,nop,TS val 2112673052 ecr 845972414], length 212
03:45:14.527068 IP 174.93.70.162.62320 > 134.122.44.78.22: Flags [.], ack 419900, win 2679, options [nop,nop,TS val 845972420 ecr 2112673028,nop,nop,sack 1 {420448:420872}], length 0
03:45:14.527147 IP 134.122.44.78.22 > 174.93.70.162.62320: Flags [P.], seq 434640:434852, ack 289, win 501, options [nop,nop,TS val 2112673056 ecr 845972420], length 212
03:45:14.527177 IP 174.93.70.162.62320 > 134.122.44.78.22: Flags [.], ack 419900, win 2679, options [nop,nop,TS val 845972420 ecr 2112673028,nop,nop,sack 1 {420448:421084}], length 0
03:45:14.527192 IP 174.93.70.162.62320 > 134.122.44.78.22: Flags [.], ack 419900, win 2679, options [nop,nop,TS val 845972420 ecr 2112673028,nop,nop,sack 1 {420448:421296}], length 0
03:45:14.527201 IP 174.93.70.162.62320 > 134.122.44.78.22: Flags [.], ack 419900, win 2679, options [nop,nop,TS val 845972420 ecr 2112673028,nop,nop,sack 1 {420448:421508}], length 0
03:45:14.527225 IP 174.93.70.162.62320 > 134.122.44.78.22: Flags [.], ack 419900, win 2679, options [nop,nop,TS val 845972420 ecr 2112673028,nop,nop,sack 1 {420448:421720}], length 0
03:45:14.527236 IP 174.93.70.162.62320 > 134.122.44.78.22: Flags [.], ack 419900, win 2679, options [nop,nop,TS val 845972420 ecr 2112673028,nop,nop,sack 1 {420448:421932}], length 0
03:45:14.527245 IP 174.93.70.162.62320 > 134.122.44.78.22: Flags [.], ack 419900, win 2679, options [nop,nop,TS val 845972420 ecr 2112673028,nop,nop,sack 1 {420448:422144}], length 0
03:45:14.527254 IP 174.93.70.162.62320 > 134.122.44.78.22: Flags [.], ack 419900, win 2679, options [nop,nop,TS val 845972420 ecr 2112673028,nop,nop,sack 1 {420448:422356}], length 0
03:45:14.527263 IP 174.93.70.162.62320 > 134.122.44.78.22: Flags [.], ack 419900, win 2679, options [nop,nop,TS val 845972420 ecr 2112673028,nop,nop,sack 1 {420448:422568}], length 0
03:45:14.527271 IP 174.93.70.162.62320 > 134.122.44.78.22: Flags [.], ack 419900, win 2679, options [nop,nop,TS val 845972420 ecr 2112673028,nop,nop,sack 1 {420448:422780}], length 0
03:45:14.527280 IP 174.93.70.162.62320 > 134.122.44.78.22: Flags [.], ack 419900, win 2679, options [nop,nop,TS val 845972420 ecr 2112673028,nop,nop,sack 1 {420448:422992}], length 0
03:45:14.527287 IP 174.93.70.162.62320 > 134.122.44.78.22: Flags [.], ack 419900, win 2679, options [nop,nop,TS val 845972420 ecr 2112673028,nop,nop,sack 1 {420448:423204}], length 0
03:45:14.527392 IP 174.93.70.162.62320 > 134.122.44.78.22: Flags [.], ack 419900, win 2679, options [nop,nop,TS val 845972420 ecr 2112673028,nop,nop,sack 1 {420448:423416}], length 0
03:45:14.527410 IP 174.93.70.162.62320 > 134.122.44.78.22: Flags [.], ack 419900, win 2679, options [nop,nop,TS val 845972420 ecr 2112673028,nop,nop,sack 1 {420448:423628}], length 0
03:45:14.527419 IP 174.93.70.162.62320 > 134.122.44.78.22: Flags [.], ack 419900, win 2679, options [nop,nop,TS val 845972420 ecr 2112673028,nop,nop,sack 1 {420448:423840}], length 0
03:45:14.527427 IP 174.93.70.162.62320 > 134.122.44.78.22: Flags [.], ack 419900, win 2679, options [nop,nop,TS val 845972420 ecr 2112673028,nop,nop,sack 1 {420448:424052}], length 0
03:45:14.528251 IP 134.122.44.78.22 > 174.93.70.162.62320: Flags [P.], seq 434852:437732, ack 289, win 501, options [nop,nop,TS val 2112673057 ecr 845972420], length 2880
03:45:14.528338 IP 134.122.44.78.22 > 174.93.70.162.62320: Flags [P.], seq 437732:438008, ack 289, win 501, options [nop,nop,TS val 2112673057 ecr 845972420], length 276
03:45:14.528541 IP 134.122.44.78.22 > 174.93.70.162.62320: Flags [P.], seq 438008:438388, ack 289, win 501, options [nop,nop,TS val 2112673057 ecr 845972420], length 380
03:45:14.528742 IP 134.122.44.78.22 > 174.93.70.162.62320: Flags [P.], seq 438388:438600, ack 289, win 501, options [nop,nop,TS val 2112673057 ecr 845972420], length 212
03:45:14.528935 IP 134.122.44.78.22 > 174.93.70.162.62320: Flags [P.], seq 438600:438812, ack 289, win 501, options [nop,nop,TS val 2112673058 ecr 845972420], length 212
03:45:14.529132 IP 134.122.44.78.22 > 174.93.70.162.62320: Flags [P.], seq 438812:439024, ack 289, win 501, options [nop,nop,TS val 2112673058 ecr 845972420], length 212
03:45:14.529320 IP 134.122.44.78.22 > 174.93.70.162.62320: Flags [P.], seq 439024:439236, ack 289, win 501, options [nop,nop,TS val 2112673058 ecr 845972420], length 212
03:45:14.529548 IP 134.122.44.78.22 > 174.93.70.162.62320: Flags [P.], seq 439236:439448, ack 289, win 501, options [nop,nop,TS val 2112673058 ecr 845972420], length 212
03:45:14.529742 IP 134.122.44.78.22 > 174.93.70.162.62320: Flags [P.], seq 439448:439660, ack 289, win 501, options [nop,nop,TS val 2112673058 ecr 845972420], length 212
03:45:14.529941 IP 134.122.44.78.22 > 174.93.70.162.62320: Flags [P.], seq 439660:439872, ack 289, win 501, options [nop,nop,TS val 2112673059 ecr 845972420], length 212
03:45:14.530119 IP 134.122.44.78.22 > 174.93.70.162.62320: Flags [P.], seq 439872:440084, ack 289, win 501, options [nop,nop,TS val 2112673059 ecr 845972420], length 212
03:45:14.530285 IP 134.122.44.78.22 > 174.93.70.162.62320: Flags [P.], seq 440084:440296, ack 289, win 501, options [nop,nop,TS val 2112673059 ecr 845972420], length 212
03:45:14.530435 IP 134.122.44.78.22 > 174.93.70.162.62320: Flags [P.], seq 440296:440508, ack 289, win 501, options [nop,nop,TS val 2112673059 ecr 845972420], length 212
03:45:14.530648 IP 134.122.44.78.22 > 174.93.70.162.62320: Flags [P.], seq 440508:440720, ack 289, win 501, options [nop,nop,TS val 2112673059 ecr 845972420], length 212
03:45:14.542899 IP 134.122.44.78.22 > 174.93.70.162.62320: Flags [P.], seq 419900:420448, ack 289, win 501, options [nop,nop,TS val 2112673072 ecr 845972420], length 548
03:45:14.547201 IP 174.93.70.162.62320 > 134.122.44.78.22: Flags [.], ack 419900, win 2679, options [nop,nop,TS val 845972420 ecr 2112673028,nop,nop,sack 1 {420448:424264}], length 0
03:45:14.547286 IP 134.122.44.78.22 > 174.93.70.162.62320: Flags [P.], seq 440720:441144, ack 289, win 501, options [nop,nop,TS val 2112673076 ecr 845972420], length 424
03:45:14.547310 IP 174.93.70.162.62320 > 134.122.44.78.22: Flags [.], ack 419900, win 2679, options [nop,nop,TS val 845972420 ecr 2112673028,nop,nop,sack 1 {420448:424476}], length 0
03:45:14.547322 IP 174.93.70.162.62320 > 134.122.44.78.22: Flags [.], ack 419900, win 2679, options [nop,nop,TS val 845972420 ecr 2112673028,nop,nop,sack 1 {420448:424688}], length 0
03:45:14.547339 IP 174.93.70.162.62320 > 134.122.44.78.22: Flags [.], ack 419900, win 2679, options [nop,nop,TS val 845972420 ecr 2112673028,nop,nop,sack 1 {420448:424900}], length 0
03:45:14.547346 IP 174.93.70.162.62320 > 134.122.44.78.22: Flags [.], ack 419900, win 2679, options [nop,nop,TS val 845972420 ecr 2112673028,nop,nop,sack 1 {420448:425112}], length 0
03:45:14.547355 IP 174.93.70.162.62320 > 134.122.44.78.22: Flags [.], ack 419900, win 2679, options [nop,nop,TS val 845972420 ecr 2112673028,nop,nop,sack 1 {420448:425324}], length 0
03:45:14.547362 IP 174.93.70.162.62320 > 134.122.44.78.22: Flags [.], ack 419900, win 2679, options [nop,nop,TS val 845972420 ecr 2112673028,nop,nop,sack 1 {420448:425536}], length 0
03:45:14.547367 IP 174.93.70.162.62320 > 134.122.44.78.22: Flags [.], ack 419900, win 2679, options [nop,nop,TS val 845972420 ecr 2112673028,nop,nop,sack 1 {420448:425748}], length 0
03:45:14.547423 IP 174.93.70.162.62320 > 134.122.44.78.22: Flags [.], ack 419900, win 2679, options [nop,nop,TS val 845972420 ecr 2112673028,nop,nop,sack 1 {420448:425960}], length 0
03:45:14.547434 IP 174.93.70.162.62320 > 134.122.44.78.22: Flags [.], ack 419900, win 2679, options [nop,nop,TS val 845972420 ecr 2112673028,nop,nop,sack 1 {420448:426172}], length 0
03:45:14.547440 IP 174.93.70.162.62320 > 134.122.44.78.22: Flags [.], ack 419900, win 2679, options [nop,nop,TS val 845972420 ecr 2112673028,nop,nop,sack 1 {420448:426384}], length 0
03:45:14.547445 IP 174.93.70.162.62320 > 134.122.44.78.22: Flags [.], ack 419900, win 2679, options [nop,nop,TS val 845972420 ecr 2112673028,nop,nop,sack 1 {420448:426596}], length 0
03:45:14.547521 IP 174.93.70.162.62320 > 134.122.44.78.22: Flags [.], ack 419900, win 2679, options [nop,nop,TS val 845972420 ecr 2112673028,nop,nop,sack 1 {420448:426808}], length 0
03:45:14.547535 IP 174.93.70.162.62320 > 134.122.44.78.22: Flags [.], ack 419900, win 2679, options [nop,nop,TS val 845972420 ecr 2112673028,nop,nop,sack 1 {420448:427020}], length 0
03:45:14.547541 IP 174.93.70.162.62320 > 134.122.44.78.22: Flags [.], ack 419900, win 2679, options [nop,nop,TS val 845972420 ecr 2112673028,nop,nop,sack 1 {420448:427232}], length 0
03:45:14.547546 IP 174.93.70.162.62320 > 134.122.44.78.22: Flags [.], ack 419900, win 2679, options [nop,nop,TS val 845972420 ecr 2112673028,nop,nop,sack 1 {420448:427444}], length 0
03:45:14.547638 IP 174.93.70.162.62320 > 134.122.44.78.22: Flags [.], ack 419900, win 2679, options [nop,nop,TS val 845972420 ecr 2112673028,nop,nop,sack 1 {420448:427656}], length 0
03:45:14.547651 IP 174.93.70.162.62320 > 134.122.44.78.22: Flags [.], ack 419900, win 2679, options [nop,nop,TS val 845972420 ecr 2112673028,nop,nop,sack 1 {420448:427868}], length 0
03:45:14.547659 IP 174.93.70.162.62320 > 134.122.44.78.22: Flags [.], ack 419900, win 2679, options [nop,nop,TS val 845972420 ecr 2112673028,nop,nop,sack 1 {420448:428080}], length 0
03:45:14.547664 IP 174.93.70.162.62320 > 134.122.44.78.22: Flags [.], ack 419900, win 2679, options [nop,nop,TS val 845972420 ecr 2112673028,nop,nop,sack 1 {420448:428292}], length 0
03:45:14.547767 IP 174.93.70.162.62320 > 134.122.44.78.22: Flags [.], ack 419900, win 2679, options [nop,nop,TS val 845972420 ecr 2112673028,nop,nop,sack 1 {420448:428504}], length 0
03:45:14.547778 IP 174.93.70.162.62320 > 134.122.44.78.22: Flags [.], ack 419900, win 2679, options [nop,nop,TS val 845972420 ecr 2112673028,nop,nop,sack 1 {420448:428716}], length 0
03:45:14.547786 IP 174.93.70.162.62320 > 134.122.44.78.22: Flags [.], ack 419900, win 2679, options [nop,nop,TS val 845972420 ecr 2112673028,nop,nop,sack 1 {420448:428928}], length 0
03:45:14.547794 IP 174.93.70.162.62320 > 134.122.44.78.22: Flags [.], ack 419900, win 2679, options [nop,nop,TS val 845972420 ecr 2112673028,nop,nop,sack 1 {420448:429140}], length 0
03:45:14.547800 IP 174.93.70.162.62320 > 134.122.44.78.22: Flags [.], ack 419900, win 2679, options [nop,nop,TS val 845972420 ecr 2112673028,nop,nop,sack 1 {420448:429352}], length 0
03:45:14.547880 IP 174.93.70.162.62320 > 134.122.44.78.22: Flags [.], ack 419900, win 2679, options [nop,nop,TS val 845972427 ecr 2112673028,nop,nop,sack 1 {420448:430172}], length 0
03:45:14.547888 IP 174.93.70.162.62320 > 134.122.44.78.22: Flags [.], ack 419900, win 2679, options [nop,nop,TS val 845972427 ecr 2112673028,nop,nop,sack 2 {430384:430596}{420448:430172}], length 0
03:45:14.548450 IP 134.122.44.78.22 > 174.93.70.162.62320: Flags [.], seq 441144:442584, ack 289, win 501, options [nop,nop,TS val 2112673077 ecr 845972427], length 1440
03:45:14.553579 IP 174.93.70.162.62320 > 134.122.44.78.22: Flags [.], ack 419900, win 2679, options [nop,nop,TS val 845972432 ecr 2112673028,nop,nop,sack 2 {430384:430808}{420448:430172}], length 0
03:45:14.553656 IP 134.122.44.78.22 > 174.93.70.162.62320: Flags [P.], seq 430172:430384, ack 289, win 501, options [nop,nop,TS val 2112673082 ecr 845972432], length 212
03:45:14.553679 IP 174.93.70.162.62320 > 134.122.44.78.22: Flags [.], ack 419900, win 2679, options [nop,nop,TS val 845972432 ecr 2112673028,nop,nop,sack 2 {430384:431324}{420448:430172}], length 0
03:45:14.553693 IP 134.122.44.78.22 > 174.93.70.162.62320: Flags [.], seq 442584:444024, ack 289, win 501, options [nop,nop,TS val 2112673082 ecr 845972432], length 1440
03:45:14.553700 IP 174.93.70.162.62320 > 134.122.44.78.22: Flags [.], ack 419900, win 2679, options [nop,nop,TS val 845972432 ecr 2112673028,nop,nop,sack 2 {430384:431536}{420448:430172}], length 0
03:45:14.553719 IP 134.122.44.78.22 > 174.93.70.162.62320: Flags [.], seq 444024:445464, ack 289, win 501, options [nop,nop,TS val 2112673082 ecr 845972432], length 1440
03:45:14.553910 IP 174.93.70.162.62320 > 134.122.44.78.22: Flags [.], ack 419900, win 2679, options [nop,nop,TS val 845972439 ecr 2112673028,nop,nop,sack 2 {430384:431748}{420448:430172}], length 0
03:45:14.553929 IP 134.122.44.78.22 > 174.93.70.162.62320: Flags [P.], seq 445464:446588, ack 289, win 501, options [nop,nop,TS val 2112673083 ecr 845972439], length 1124
03:45:14.553948 IP 174.93.70.162.62320 > 134.122.44.78.22: Flags [.], ack 419900, win 2679, options [nop,nop,TS val 845972439 ecr 2112673028,nop,nop,sack 2 {430384:433188}{420448:430172}], length 0
03:45:14.553958 IP 174.93.70.162.62320 > 134.122.44.78.22: Flags [.], ack 419900, win 2679, options [nop,nop,TS val 845972439 ecr 2112673028,nop,nop,sack 2 {430384:433368}{420448:430172}], length 0
03:45:14.554001 IP 174.93.70.162.62320 > 134.122.44.78.22: Flags [.], ack 419900, win 2679, options [nop,nop,TS val 845972439 ecr 2112673028,nop,nop,sack 2 {430384:433580}{420448:430172}], length 0
03:45:14.554008 IP 174.93.70.162.62320 > 134.122.44.78.22: Flags [.], ack 419900, win 2679, options [nop,nop,TS val 845972439 ecr 2112673028,nop,nop,sack 2 {430384:433792}{420448:430172}], length 0
03:45:14.554014 IP 174.93.70.162.62320 > 134.122.44.78.22: Flags [.], ack 419900, win 2679, options [nop,nop,TS val 845972439 ecr 2112673028,nop,nop,sack 2 {430384:434004}{420448:430172}], length 0
03:45:14.554020 IP 174.93.70.162.62320 > 134.122.44.78.22: Flags [.], ack 419900, win 2679, options [nop,nop,TS val 845972439 ecr 2112673028,nop,nop,sack 2 {430384:434216}{420448:430172}], length 0
03:45:14.554145 IP 174.93.70.162.62320 > 134.122.44.78.22: Flags [.], ack 419900, win 2679, options [nop,nop,TS val 845972439 ecr 2112673028,nop,nop,sack 2 {430384:434428}{420448:430172}], length 0
03:45:14.554156 IP 174.93.70.162.62320 > 134.122.44.78.22: Flags [.], ack 419900, win 2679, options [nop,nop,TS val 845972439 ecr 2112673028,nop,nop,sack 2 {430384:434640}{420448:430172}], length 0
03:45:14.554162 IP 174.93.70.162.62320 > 134.122.44.78.22: Flags [.], ack 419900, win 2679, options [nop,nop,TS val 845972442 ecr 2112673028,nop,nop,sack 2 {430384:434852}{420448:430172}], length 0
03:45:14.554167 IP 174.93.70.162.62320 > 134.122.44.78.22: Flags [.], ack 419900, win 2679, options [nop,nop,TS val 845972442 ecr 2112673028,nop,nop,sack 2 {430384:436292}{420448:430172}], length 0
03:45:14.554253 IP 174.93.70.162.62320 > 134.122.44.78.22: Flags [.], ack 419900, win 2679, options [nop,nop,TS val 845972442 ecr 2112673028,nop,nop,sack 2 {430384:437732}{420448:430172}], length 0
03:45:14.554265 IP 174.93.70.162.62320 > 134.122.44.78.22: Flags [.], ack 419900, win 2679, options [nop,nop,TS val 845972442 ecr 2112673028,nop,nop,sack 2 {430384:438008}{420448:430172}], length 0
03:45:14.554269 IP 174.93.70.162.62320 > 134.122.44.78.22: Flags [.], ack 419900, win 2679, options [nop,nop,TS val 845972442 ecr 2112673028,nop,nop,sack 2 {430384:438388}{420448:430172}], length 0
03:45:14.554274 IP 174.93.70.162.62320 > 134.122.44.78.22: Flags [.], ack 419900, win 2679, options [nop,nop,TS val 845972442 ecr 2112673028,nop,nop,sack 2 {430384:438600}{420448:430172}], length 0
03:45:14.554375 IP 174.93.70.162.62320 > 134.122.44.78.22: Flags [.], ack 419900, win 2679, options [nop,nop,TS val 845972442 ecr 2112673028,nop,nop,sack 2 {430384:438812}{420448:430172}], length 0
03:45:14.554450 IP 134.122.44.78.22 > 174.93.70.162.62320: Flags [.], seq 446588:448028, ack 289, win 501, options [nop,nop,TS val 2112673083 ecr 845972442], length 1440
03:45:14.554534 IP 174.93.70.162.62320 > 134.122.44.78.22: Flags [.], ack 419900, win 2679, options [nop,nop,TS val 845972442 ecr 2112673028,nop,nop,sack 2 {430384:439024}{420448:430172}], length 0
03:45:14.554549 IP 134.122.44.78.22 > 174.93.70.162.62320: Flags [P.], seq 448028:448304, ack 289, win 501, options [nop,nop,TS val 2112673083 ecr 845972442], length 276
03:45:14.554572 IP 174.93.70.162.62320 > 134.122.44.78.22: Flags [.], ack 419900, win 2679, options [nop,nop,TS val 845972442 ecr 2112673028,nop,nop,sack 2 {430384:439236}{420448:430172}], length 0
03:45:14.554647 IP 174.93.70.162.62320 > 134.122.44.78.22: Flags [.], ack 419900, win 2679, options [nop,nop,TS val 845972442 ecr 2112673028,nop,nop,sack 2 {430384:439448}{420448:430172}], length 0
03:45:14.554657 IP 174.93.70.162.62320 > 134.122.44.78.22: Flags [.], ack 419900, win 2679, options [nop,nop,TS val 845972442 ecr 2112673028,nop,nop,sack 2 {430384:439660}{420448:430172}], length 0
03:45:14.554662 IP 174.93.70.162.62320 > 134.122.44.78.22: Flags [.], ack 419900, win 2679, options [nop,nop,TS val 845972442 ecr 2112673028,nop,nop,sack 2 {430384:439872}{420448:430172}], length 0
03:45:14.554667 IP 174.93.70.162.62320 > 134.122.44.78.22: Flags [.], ack 419900, win 2679, options [nop,nop,TS val 845972442 ecr 2112673028,nop,nop,sack 2 {430384:440084}{420448:430172}], length 0
03:45:14.554673 IP 174.93.70.162.62320 > 134.122.44.78.22: Flags [.], ack 419900, win 2679, options [nop,nop,TS val 845972442 ecr 2112673028,nop,nop,sack 2 {430384:440296}{420448:430172}], length 0
03:45:14.554765 IP 174.93.70.162.62320 > 134.122.44.78.22: Flags [.], ack 419900, win 2679, options [nop,nop,TS val 845972442 ecr 2112673028,nop,nop,sack 2 {430384:440508}{420448:430172}], length 0
03:45:14.554773 IP 174.93.70.162.62320 > 134.122.44.78.22: Flags [.], ack 419900, win 2679, options [nop,nop,TS val 845972442 ecr 2112673028,nop,nop,sack 2 {430384:440720}{420448:430172}], length 0
03:45:14.554785 IP 134.122.44.78.22 > 174.93.70.162.62320: Flags [P.], seq 448304:448540, ack 289, win 501, options [nop,nop,TS val 2112673083 ecr 845972442], length 236
03:45:14.555085 IP 134.122.44.78.22 > 174.93.70.162.62320: Flags [P.], seq 448540:449376, ack 289, win 501, options [nop,nop,TS val 2112673084 ecr 845972442], length 836
03:45:14.560977 IP 174.93.70.162.62320 > 134.122.44.78.22: Flags [.], ack 430172, win 2518, options [nop,nop,TS val 845972457 ecr 2112673072,nop,nop,sack 1 {430384:440720}], length 0
03:45:14.561066 IP 134.122.44.78.22 > 174.93.70.162.62320: Flags [P.], seq 449376:452256, ack 289, win 501, options [nop,nop,TS val 2112673090 ecr 845972457], length 2880
03:45:14.561095 IP 134.122.44.78.22 > 174.93.70.162.62320: Flags [P.], seq 452256:454016, ack 289, win 501, options [nop,nop,TS val 2112673090 ecr 845972457], length 1760
03:45:14.561102 IP 174.93.70.162.62320 > 134.122.44.78.22: Flags [.], ack 430172, win 2646, options [nop,nop,TS val 845972457 ecr 2112673072,nop,nop,sack 1 {430384:440720}], length 0
03:45:14.561326 IP 134.122.44.78.22 > 174.93.70.162.62320: Flags [P.], seq 454016:454236, ack 289, win 501, options [nop,nop,TS val 2112673090 ecr 845972457], length 220
03:45:14.561673 IP 134.122.44.78.22 > 174.93.70.162.62320: Flags [P.], seq 454236:454272, ack 289, win 501, options [nop,nop,TS val 2112673090 ecr 845972457], length 36
03:45:14.561861 IP 134.122.44.78.22 > 174.93.70.162.62320: Flags [P.], seq 454272:454476, ack 289, win 501, options [nop,nop,TS val 2112673091 ecr 845972457], length 204
03:45:14.562107 IP 134.122.44.78.22 > 174.93.70.162.62320: Flags [P.], seq 454476:455040, ack 289, win 501, options [nop,nop,TS val 2112673091 ecr 845972457], length 564
03:45:14.562365 IP 134.122.44.78.22 > 174.93.70.162.62320: Flags [P.], seq 455040:455588, ack 289, win 501, options [nop,nop,TS val 2112673091 ecr 845972457], length 548
03:45:14.562555 IP 134.122.44.78.22 > 174.93.70.162.62320: Flags [P.], seq 455588:455800, ack 289, win 501, options [nop,nop,TS val 2112673091 ecr 845972457], length 212
03:45:14.562841 IP 134.122.44.78.22 > 174.93.70.162.62320: Flags [P.], seq 455800:456012, ack 289, win 501, options [nop,nop,TS val 2112673092 ecr 845972457], length 212
03:45:14.563037 IP 134.122.44.78.22 > 174.93.70.162.62320: Flags [P.], seq 456012:456224, ack 289, win 501, options [nop,nop,TS val 2112673092 ecr 845972457], length 212
03:45:14.563258 IP 134.122.44.78.22 > 174.93.70.162.62320: Flags [P.], seq 456224:456436, ack 289, win 501, options [nop,nop,TS val 2112673092 ecr 845972457], length 212
03:45:14.563464 IP 134.122.44.78.22 > 174.93.70.162.62320: Flags [P.], seq 456436:456648, ack 289, win 501, options [nop,nop,TS val 2112673092 ecr 845972457], length 212
03:45:14.563665 IP 134.122.44.78.22 > 174.93.70.162.62320: Flags [P.], seq 456648:456860, ack 289, win 501, options [nop,nop,TS val 2112673092 ecr 845972457], length 212
03:45:14.563843 IP 134.122.44.78.22 > 174.93.70.162.62320: Flags [P.], seq 456860:457072, ack 289, win 501, options [nop,nop,TS val 2112673093 ecr 845972457], length 212
03:45:14.564020 IP 134.122.44.78.22 > 174.93.70.162.62320: Flags [P.], seq 457072:457284, ack 289, win 501, options [nop,nop,TS val 2112673093 ecr 845972457], length 212
03:45:14.564206 IP 134.122.44.78.22 > 174.93.70.162.62320: Flags [P.], seq 457284:457496, ack 289, win 501, options [nop,nop,TS val 2112673093 ecr 845972457], length 212
03:45:14.564462 IP 134.122.44.78.22 > 174.93.70.162.62320: Flags [P.], seq 457496:457708, ack 289, win 501, options [nop,nop,TS val 2112673093 ecr 845972457], length 212
03:45:14.564661 IP 134.122.44.78.22 > 174.93.70.162.62320: Flags [P.], seq 457708:457920, ack 289, win 501, options [nop,nop,TS val 2112673093 ecr 845972457], length 212
03:45:14.564856 IP 134.122.44.78.22 > 174.93.70.162.62320: Flags [P.], seq 457920:458132, ack 289, win 501, options [nop,nop,TS val 2112673094 ecr 845972457], length 212
03:45:14.565046 IP 134.122.44.78.22 > 174.93.70.162.62320: Flags [P.], seq 458132:458344, ack 289, win 501, options [nop,nop,TS val 2112673094 ecr 845972457], length 212
03:45:14.565232 IP 134.122.44.78.22 > 174.93.70.162.62320: Flags [P.], seq 458344:458556, ack 289, win 501, options [nop,nop,TS val 2112673094 ecr 845972457], length 212
03:45:14.565435 IP 134.122.44.78.22 > 174.93.70.162.62320: Flags [P.], seq 458556:458768, ack 289, win 501, options [nop,nop,TS val 2112673094 ecr 845972457], length 212
03:45:14.565662 IP 134.122.44.78.22 > 174.93.70.162.62320: Flags [P.], seq 458768:458980, ack 289, win 501, options [nop,nop,TS val 2112673094 ecr 845972457], length 212
03:45:14.565868 IP 134.122.44.78.22 > 174.93.70.162.62320: Flags [P.], seq 458980:459192, ack 289, win 501, options [nop,nop,TS val 2112673095 ecr 845972457], length 212
03:45:14.566093 IP 134.122.44.78.22 > 174.93.70.162.62320: Flags [P.], seq 459192:459404, ack 289, win 501, options [nop,nop,TS val 2112673095 ecr 845972457], length 212
03:45:14.566307 IP 134.122.44.78.22 > 174.93.70.162.62320: Flags [P.], seq 459404:459616, ack 289, win 501, options [nop,nop,TS val 2112673095 ecr 845972457], length 212
03:45:14.566493 IP 134.122.44.78.22 > 174.93.70.162.62320: Flags [P.], seq 459616:459828, ack 289, win 501, options [nop,nop,TS val 2112673095 ecr 845972457], length 212
03:45:14.569447 IP 174.93.70.162.62320 > 134.122.44.78.22: Flags [.], ack 430172, win 2679, options [nop,nop,TS val 845972461 ecr 2112673072,nop,nop,sack 1 {430384:441144}], length 0
03:45:14.569545 IP 134.122.44.78.22 > 174.93.70.162.62320: Flags [P.], seq 459828:460040, ack 289, win 501, options [nop,nop,TS val 2112673098 ecr 845972461], length 212
03:45:14.569571 IP 174.93.70.162.62320 > 134.122.44.78.22: Flags [.], ack 430172, win 2679, options [nop,nop,TS val 845972461 ecr 2112673072,nop,nop,sack 1 {430384:442584}], length 0
03:45:14.569843 IP 134.122.44.78.22 > 174.93.70.162.62320: Flags [P.], seq 460040:460620, ack 289, win 501, options [nop,nop,TS val 2112673099 ecr 845972461], length 580
03:45:14.577856 IP 174.93.70.162.62320 > 134.122.44.78.22: Flags [.], ack 442584, win 2485, options [nop,nop,TS val 845972462 ecr 2112673082], length 0
03:45:14.577953 IP 134.122.44.78.22 > 174.93.70.162.62320: Flags [P.], seq 460620:460832, ack 289, win 501, options [nop,nop,TS val 2112673107 ecr 845972462], length 212
03:45:14.577988 IP 174.93.70.162.62320 > 134.122.44.78.22: Flags [.], ack 445464, win 2440, options [nop,nop,TS val 845972462 ecr 2112673082], length 0
03:45:14.578014 IP 174.93.70.162.62320 > 134.122.44.78.22: Flags [.], ack 446588, win 2422, options [nop,nop,TS val 845972462 ecr 2112673083], length 0
03:45:14.578146 IP 174.93.70.162.62320 > 134.122.44.78.22: Flags [.], ack 448304, win 2396, options [nop,nop,TS val 845972462 ecr 2112673083], length 0
03:45:14.578158 IP 174.93.70.162.62320 > 134.122.44.78.22: Flags [.], ack 448540, win 2392, options [nop,nop,TS val 845972462 ecr 2112673083], length 0
03:45:14.578163 IP 174.93.70.162.62320 > 134.122.44.78.22: Flags [.], ack 449376, win 2379, options [nop,nop,TS val 845972462 ecr 2112673084], length 0
03:45:14.578168 IP 174.93.70.162.62320 > 134.122.44.78.22: Flags [.], ack 449376, win 2507, options [nop,nop,TS val 845972462 ecr 2112673084], length 0
03:45:14.578478 IP 134.122.44.78.22 > 174.93.70.162.62320: Flags [P.], seq 460832:462108, ack 289, win 501, options [nop,nop,TS val 2112673107 ecr 845972462], length 1276
03:45:14.578728 IP 134.122.44.78.22 > 174.93.70.162.62320: Flags [P.], seq 462108:462320, ack 289, win 501, options [nop,nop,TS val 2112673107 ecr 845972462], length 212
03:45:14.578927 IP 134.122.44.78.22 > 174.93.70.162.62320: Flags [P.], seq 462320:462532, ack 289, win 501, options [nop,nop,TS val 2112673108 ecr 845972462], length 212
03:45:14.579062 IP 134.122.44.78.22 > 174.93.70.162.62320: Flags [P.], seq 462532:462744, ack 289, win 501, options [nop,nop,TS val 2112673108 ecr 845972462], length 212
03:45:14.579191 IP 134.122.44.78.22 > 174.93.70.162.62320: Flags [P.], seq 462744:462956, ack 289, win 501, options [nop,nop,TS val 2112673108 ecr 845972462], length 212
03:45:14.579320 IP 134.122.44.78.22 > 174.93.70.162.62320: Flags [P.], seq 462956:463168, ack 289, win 501, options [nop,nop,TS val 2112673108 ecr 845972462], length 212
03:45:14.579565 IP 134.122.44.78.22 > 174.93.70.162.62320: Flags [P.], seq 463168:463380, ack 289, win 501, options [nop,nop,TS val 2112673108 ecr 845972462], length 212
03:45:14.585197 IP 174.93.70.162.62320 > 134.122.44.78.22: Flags [.], ack 450816, win 2484, options [nop,nop,TS val 845972471 ecr 2112673090,nop,nop,sack 1 {453696:454016}], length 0
03:45:14.585266 IP 134.122.44.78.22 > 174.93.70.162.62320: Flags [P.], seq 463380:463592, ack 289, win 501, options [nop,nop,TS val 2112673114 ecr 845972471], length 212
03:45:14.585301 IP 174.93.70.162.62320 > 134.122.44.78.22: Flags [.], ack 452256, win 2462, options [nop,nop,TS val 845972471 ecr 2112673090,nop,nop,sack 1 {453696:454016}], length 0
03:45:14.585338 IP 174.93.70.162.62320 > 134.122.44.78.22: Flags [.], ack 454016, win 2434, options [nop,nop,TS val 845972471 ecr 2112673090], length 0
03:45:14.585351 IP 174.93.70.162.62320 > 134.122.44.78.22: Flags [.], ack 454236, win 2431, options [nop,nop,TS val 845972471 ecr 2112673090], length 0
03:45:14.585827 IP 134.122.44.78.22 > 174.93.70.162.62320: Flags [P.], seq 463592:464476, ack 289, win 501, options [nop,nop,TS val 2112673115 ecr 845972471], length 884
03:45:14.586012 IP 134.122.44.78.22 > 174.93.70.162.62320: Flags [P.], seq 464476:464688, ack 289, win 501, options [nop,nop,TS val 2112673115 ecr 845972471], length 212
03:45:14.586165 IP 134.122.44.78.22 > 174.93.70.162.62320: Flags [P.], seq 464688:464900, ack 289, win 501, options [nop,nop,TS val 2112673115 ecr 845972471], length 212
03:45:14.586295 IP 134.122.44.78.22 > 174.93.70.162.62320: Flags [P.], seq 464900:465112, ack 289, win 501, options [nop,nop,TS val 2112673115 ecr 845972471], length 212
03:45:14.587039 IP 174.93.70.162.62320 > 134.122.44.78.22: Flags [.], ack 454272, win 2430, options [nop,nop,TS val 845972471 ecr 2112673090], length 0
03:45:14.587068 IP 134.122.44.78.22 > 174.93.70.162.62320: Flags [P.], seq 465112:465324, ack 289, win 501, options [nop,nop,TS val 2112673116 ecr 845972471], length 212
03:45:14.587092 IP 174.93.70.162.62320 > 134.122.44.78.22: Flags [.], ack 454476, win 2427, options [nop,nop,TS val 845972471 ecr 2112673091], length 0
03:45:14.587103 IP 174.93.70.162.62320 > 134.122.44.78.22: Flags [.], ack 455040, win 2418, options [nop,nop,TS val 845972471 ecr 2112673091], length 0
03:45:14.587111 IP 174.93.70.162.62320 > 134.122.44.78.22: Flags [.], ack 455588, win 2410, options [nop,nop,TS val 845972471 ecr 2112673091], length 0
03:45:14.587395 IP 134.122.44.78.22 > 174.93.70.162.62320: Flags [P.], seq 465324:466144, ack 289, win 501, options [nop,nop,TS val 2112673116 ecr 845972471], length 820
03:45:14.587559 IP 134.122.44.78.22 > 174.93.70.162.62320: Flags [P.], seq 466144:466356, ack 289, win 501, options [nop,nop,TS val 2112673116 ecr 845972471], length 212
03:45:14.587761 IP 134.122.44.78.22 > 174.93.70.162.62320: Flags [P.], seq 466356:466568, ack 289, win 501, options [nop,nop,TS val 2112673116 ecr 845972471], length 212
03:45:14.592079 IP 174.93.70.162.62320 > 134.122.44.78.22: Flags [.], ack 455800, win 2406, options [nop,nop,TS val 845972472 ecr 2112673091], length 0
03:45:14.592123 IP 134.122.44.78.22 > 174.93.70.162.62320: Flags [P.], seq 466568:466780, ack 289, win 501, options [nop,nop,TS val 2112673121 ecr 845972472], length 212
03:45:14.592149 IP 174.93.70.162.62320 > 134.122.44.78.22: Flags [.], ack 456012, win 2403, options [nop,nop,TS val 845972472 ecr 2112673092], length 0
03:45:14.592162 IP 174.93.70.162.62320 > 134.122.44.78.22: Flags [.], ack 456224, win 2400, options [nop,nop,TS val 845972472 ecr 2112673092], length 0
03:45:14.592169 IP 174.93.70.162.62320 > 134.122.44.78.22: Flags [.], ack 456436, win 2397, options [nop,nop,TS val 845972472 ecr 2112673092], length 0
03:45:14.592177 IP 174.93.70.162.62320 > 134.122.44.78.22: Flags [.], ack 456648, win 2393, options [nop,nop,TS val 845972472 ecr 2112673092], length 0
03:45:14.592184 IP 174.93.70.162.62320 > 134.122.44.78.22: Flags [.], ack 456860, win 2390, options [nop,nop,TS val 845972472 ecr 2112673092], length 0
03:45:14.592208 IP 174.93.70.162.62320 > 134.122.44.78.22: Flags [.], ack 457072, win 2387, options [nop,nop,TS val 845972472 ecr 2112673093], length 0
03:45:14.592217 IP 174.93.70.162.62320 > 134.122.44.78.22: Flags [.], ack 457284, win 2383, options [nop,nop,TS val 845972472 ecr 2112673093], length 0
03:45:14.592225 IP 174.93.70.162.62320 > 134.122.44.78.22: Flags [.], ack 457496, win 2380, options [nop,nop,TS val 845972472 ecr 2112673093], length 0
03:45:14.592233 IP 174.93.70.162.62320 > 134.122.44.78.22: Flags [.], ack 457708, win 2377, options [nop,nop,TS val 845972472 ecr 2112673093], length 0
03:45:14.592241 IP 174.93.70.162.62320 > 134.122.44.78.22: Flags [.], ack 457920, win 2373, options [nop,nop,TS val 845972472 ecr 2112673093], length 0
03:45:14.592249 IP 174.93.70.162.62320 > 134.122.44.78.22: Flags [.], ack 458132, win 2370, options [nop,nop,TS val 845972472 ecr 2112673094], length 0
03:45:14.592256 IP 174.93.70.162.62320 > 134.122.44.78.22: Flags [.], ack 458344, win 2367, options [nop,nop,TS val 845972472 ecr 2112673094], length 0
03:45:14.592294 IP 174.93.70.162.62320 > 134.122.44.78.22: Flags [.], ack 458556, win 2363, options [nop,nop,TS val 845972472 ecr 2112673094], length 0
03:45:14.592304 IP 174.93.70.162.62320 > 134.122.44.78.22: Flags [.], ack 458768, win 2360, options [nop,nop,TS val 845972472 ecr 2112673094], length 0
03:45:14.592325 IP 174.93.70.162.62320 > 134.122.44.78.22: Flags [.], ack 458980, win 2357, options [nop,nop,TS val 845972472 ecr 2112673094], length 0
03:45:14.592337 IP 174.93.70.162.62320 > 134.122.44.78.22: Flags [.], ack 459192, win 2353, options [nop,nop,TS val 845972472 ecr 2112673095], length 0
03:45:14.592345 IP 174.93.70.162.62320 > 134.122.44.78.22: Flags [.], ack 459404, win 2350, options [nop,nop,TS val 845972472 ecr 2112673095], length 0
03:45:14.592352 IP 174.93.70.162.62320 > 134.122.44.78.22: Flags [.], ack 459616, win 2347, options [nop,nop,TS val 845972472 ecr 2112673095], length 0
03:45:14.592359 IP 174.93.70.162.62320 > 134.122.44.78.22: Flags [.], ack 459828, win 2344, options [nop,nop,TS val 845972473 ecr 2112673095], length 0
03:45:14.592367 IP 174.93.70.162.62320 > 134.122.44.78.22: Flags [.], ack 459828, win 2472, options [nop,nop,TS val 845972473 ecr 2112673095], length 0
03:45:14.592373 IP 174.93.70.162.62320 > 134.122.44.78.22: Flags [.], ack 459828, win 2600, options [nop,nop,TS val 845972476 ecr 2112673095], length 0
03:45:14.592378 IP 174.93.70.162.62320 > 134.122.44.78.22: Flags [.], ack 459828, win 2600, options [nop,nop,TS val 845972476 ecr 2112673095,nop,nop,sack 1 {460040:460620}], length 0
03:45:14.592391 IP 174.93.70.162.62320 > 134.122.44.78.22: Flags [.], ack 459828, win 2679, options [nop,nop,TS val 845972478 ecr 2112673095,nop,nop,sack 1 {460040:460620}], length 0
03:45:14.592399 IP 174.93.70.162.62320 > 134.122.44.78.22: Flags [P.], seq 289:325, ack 459828, win 2679, options [nop,nop,TS val 845972478 ecr 2112673095,nop,nop,sack 1 {460040:460620}], length 36
^C
2526 packets captured
2673 packets received by filter
146 packets dropped by kernel
root@CyberSecurityTK:~# 